### DISCUSSION TITLE
TL280 v4.1

### DISCUSSION THREAD

**Discussion by Villhahallon** [BrianHumlicek/NeoHub#3] [General]
It would be great if we could force some tests from the web interface.

I think I got all the settings right in my panel, Even got the DLS 5 working and could check all the settings.
But nothing is connecting to the web interface. 
When booting the docker container I get a few errors in the container log. I will paste them here.

I'm not even sure if my TL280 card will work, It is running the v4.1 firmware and I can't see any information about a possible update either.
Would be fun to get it working.

```
info: NeoHub.Services.Settings.SettingsDiscoveryService[0]
      Scanning 2 assemblies for settings types
info: NeoHub.Services.Settings.SettingsDiscoveryService[0]
      Discovered settings: Diagnostics (DiagnosticsSettings)
info: NeoHub.Services.Settings.SettingsDiscoveryService[0]
      Discovered settings: DSC.TLink (ITv2Settings)
info: NeoHub.Services.Settings.SettingsDiscoveryService[0]
      Discovered 2 settings sections
warn: Microsoft.AspNetCore.DataProtection.Repositories.FileSystemXmlRepository[60]
      Storing keys in a directory '/root/.aspnet/DataProtection-Keys' that may not be persisted outside of the container. Protected data will be unavailable when container is destroyed. For more information go to https://aka.ms/aspnet/dataprotectionwarning
warn: Microsoft.AspNetCore.DataProtection.KeyManagement.XmlKeyManager[35]
      No XML encryptor configured. Key {9a100c3b-fec3-451e-a4a2-29b43911b889} may be persisted to storage in unencrypted form.
warn: Microsoft.AspNetCore.Server.Kestrel[0]
      Overriding address(es) 'http://*:8080'. Binding to endpoints defined via IConfiguration and/or UseKestrel() instead.
info: Microsoft.Hosting.Lifetime[14]
      Now listening on: http://[::]:3072
info: Microsoft.Hosting.Lifetime[14]
      Now listening on: http://[::]:8080
info: Microsoft.Hosting.Lifetime[0]
      Application started. Press Ctrl+C to shut down.
info: Microsoft.Hosting.Lifetime[0]
      Hosting environment: Production
info: Microsoft.Hosting.Lifetime[0]
      Content root path: /app
warn: Microsoft.AspNetCore.HttpsPolicy.HttpsRedirectionMiddleware[3]
      Failed to determine the https port for redirect.
fail: Microsoft.AspNetCore.Antiforgery.DefaultAntiforgery[7]
      An exception was thrown while deserializing the token.
      Microsoft.AspNetCore.Antiforgery.AntiforgeryValidationException: The antiforgery token could not be decrypted.
       ---> System.Security.Cryptography.CryptographicException: The key {8ba0fc5a-478f-4a16-af6f-a88983393ee7} was not found in the key ring. For more information go to https://aka.ms/aspnet/dataprotectionwarning
         at Microsoft.AspNetCore.DataProtection.KeyManagement.KeyRingBasedDataProtector.UnprotectCore(Byte[] protectedData, Boolean allowOperationsOnRevokedKeys, UnprotectStatus& status)
         at Microsoft.AspNetCore.DataProtection.KeyManagement.KeyRingBasedDataProtector.Unprotect(Byte[] protectedData)
         at Microsoft.AspNetCore.Antiforgery.DefaultAntiforgeryTokenSerializer.Deserialize(String serializedToken)
         --- End of inner exception stack trace ---
         at Microsoft.AspNetCore.Antiforgery.DefaultAntiforgeryTokenSerializer.Deserialize(String serializedToken)
         at Microsoft.AspNetCore.Antiforgery.DefaultAntiforgery.GetCookieTokenDoesNotThrow(HttpContext httpContext)
info: NeoHub.Services.Settings.SettingsPersistenceService[0]
      Settings file: /app/persist/userSettings.json
info: NeoHub.Services.Settings.SettingsPersistenceService[0]
      Saved settings for section Diagnostics
info: NeoHub.Services.Settings.SettingsPersistenceService[0]
      Saved settings for section DSC.TLink
```

**Comment by BrianHumlicek** [comment]
That appears to have to do with asp's default of trying to redirect to https and the issue of .net in a container not having a default certificate it can use.  I purposely didn't register the https endpoint to force it to allow http.

That should be ok.  If not, I'll try and figure out what is different in my system.

**Comment by Villhahallon** [comment]
I'm stuck with my setup. The v4.1 should work if I read most of the instructions I find online. But I can't get any reaction on my web interface. I have checked traffic on the network also but can't see anything.

Would you care to explain the flow this setup uses. What settings in the panel should be set to communicate with the web server? I set the integration ip.to.my server, and port to 3072? Or am I missing something.

**Reply by BrianHumlicek** [reply]
Well, we have two hurdles to get over to solve this.

1. I'm not 100% certain exactly what parameters are required.  However, I am 95% sure, so this isn't a huge deal, but it is something to be aware of.

2. I'm not sure what the parameter numbers on your firmware are, and how those map to parameters on v5.0+.

I wonder if using DLS would help solve this.  Do you have a copy or can you find it?  If not, I can probably get it to you.  I think that might be the quickest way to see what you have available and make the necessary changes.  Once we know the parameter numbers, we can document it.

Brian

**Reply by Villhahallon** [reply]
I have an copy of DLS 5. I will see if I can export my configuration and send it to you later when I have put the kids to bed.

I compared a few settings but a few is not found in the confirmation on version.

**Reply by BrianHumlicek** [reply]
What time zone are you in?  I'm on Eastern time UTC-5.  Maybe we could screen share or something to try and work it out.

Brian

**Reply by Villhahallon** [reply]
I'm in GMT+1, (Sweden)
That would be great. How would you like to screen share? :)

**Reply by Villhahallon** [reply]
[tl280-new.xml](https://github.com/user-attachments/files/25327612/tl280-new.xml)
I exported the DLS account. Should be a clean import.
I managed to loose connection and a few of my last updates is not in this file.
But I hope there is something to find in this. 

I currently have set the network to IP:192.168.1.100/24 GW: 192.168.1.253, DNS server: 192.168.1.240, integration server: 192.168.1.248, (and then my local pc for testing)

**Reply by BrianHumlicek** [reply]
I think Zoom or Slack would probably be easiest.  Contact me at my Github name at gmail and we can coordinate.

**Reply by BrianHumlicek** [reply]
-Try setting [851][664] Integration Polling Method to Disabled.
-[851][693] Should be the address of the NeoHub server (it appears to be set correctly)
-I would probably clear [851][697] Integration Server DNS.
-[851][652] Integration Access Code will correspond to the Type 1 Access Code setting in NeoHub.  It appears to be the default value so its probably set correctly.

I think that might make it work

Brian

**Reply by Villhahallon** [reply]
I have sent you an email for further contact.

I changed those settings you wrote above but still no luck. Did a restart of the system but nothing happens.

But I did check what happens when running tcpdump on  the host (tcpdump port 3072)
And this is what shows in the console:
```
20:06:04.018299 IP 192.168.1.100.3071 > cee1d038b5ae.3072: Flags [S], seq 16480639, win 2048, options [mss 546], length 0
20:06:04.018330 IP cee1d038b5ae.3072 > 192.168.1.100.3071: Flags [R.], seq 0, ack 11158099, win 0, length 0
20:06:12.048205 IP 192.168.1.100.3071 > cee1d038b5ae.3072: Flags [S], seq 833651, win 2048, options [mss 546], length 0
20:06:12.048230 IP cee1d038b5ae.3072 > 192.168.1.100.3071: Flags [R.], seq 0, ack 4290478407, win 0, length 0
20:06:20.078152 IP 192.168.1.100.50065 > cee1d038b5ae.3072: Flags [S], seq 1923810, win 2048, options [mss 546], length 0
20:06:20.078178 IP cee1d038b5ae.3072 > 192.168.1.100.50065: Flags [R.], seq 0, ack 1923811, win 0, length 0
20:06:37.128036 IP 192.168.1.100.3071 > cee1d038b5ae.3072: Flags [S], seq 4168255, win 2048, options [mss 546], length 0
20:06:37.128061 IP cee1d038b5ae.3072 > 192.168.1.100.3071: Flags [R.], seq 0, ack 4293813011, win 0, length 0
20:06:45.158055 IP 192.168.1.100.3071 > cee1d038b5ae.3072: Flags [S], seq 5258414, win 2048, options [mss 546], length 0
20:06:45.158082 IP cee1d038b5ae.3072 > 192.168.1.100.3071: Flags [R.], seq 0, ack 4294903170, win 0, length 0
20:06:53.187985 IP 192.168.1.100.52284 > cee1d038b5ae.3072: Flags [S], seq 6348573, win 2048, options [mss 546], length 0
20:06:53.188040 IP cee1d038b5ae.3072 > 192.168.1.100.52284: Flags [R.], seq 0, ack 6348574, win 0, length 0
^C
26 packets captured
26 packets received by filter
0 packets dropped by kernel
root@cee1d038b5ae:/app# 
```

Something seems to come in to the Neohub server.

**Reply by BrianHumlicek** [reply]
That appears to show your host system is rejecting the TCP request.  I'm sure that are numerous things that could cause it so I wont even speculate.  I think you need to figure out how to get that port request to the container.

Brian

**Reply by Villhahallon** [reply]
hmm, well it gets to the container.  The tcpdump command was running the the docker container. Will do some more testing and see what is happening on the container side.

At least the tl280 talks.
:partying_face:

**Reply by Villhahallon** [reply]
Checking in the container log I see this now:
```
      Connection request from [::ffff:192.168.1.100]:3071

info: DSC.TLink.ITv2.ITv2Session[0]

      Received connection from Integration ID 151014018911

info: DSC.TLink.ITv2.ITv2Session[0]

      Open Session message for encryption type Type1

info: DSC.TLink.ITv2.ITv2Session[0]

      Encryption handler set to Type1

info: DSC.TLink.ITv2.ITv2Session[0]

      Request Access message received

info: DSC.TLink.ITv2.ITv2Session[0]

      Session 151014018911 initialized successfully

info: DSC.TLink.ITv2.MediatR.ITv2SessionManager[0]

      Registered session 151014018911. Active sessions: 1

info: NeoHub.Services.Handlers.SessionLifecycleHandler[0]

      Session connected: 151014018911

info: DSC.TLink.ITv2.ITv2Session[0]

      ITv2 session started, listening for messages.

warn: DSC.TLink.ITv2.ITv2Session[0]

      Command Logging_Panel_Event_Buffer_Notification

warn: DSC.TLink.ITv2.ITv2Session[0]

      Data: [01-00-03-25-52-5F]

warn: DSC.TLink.ITv2.ITv2Session[0]

      Command Notification_Text

warn: DSC.TLink.ITv2.ITv2Session[0]

      Data: [03-4C-00-53-00-E4-00-6B-00-65-00-72-00-68-00-65-00-74-00-73-00-73-00-79-00-73-00-74-00-65-00-6D-00-20-00-53-00-79-00-73-00-74-00-65-00-6D-00-20-00-41-00-72-00-65-00-61-00-20-00-4B-00-61-00-6C-00-6C-00-73-00-74-00-61-00-72-00-74-00-20]

warn: DSC.TLink.ITv2.ITv2Session[0]

      Command Notification_Any_Life_Safety_Communicable_Event

warn: DSC.TLink.ITv2.ITv2Session[0]

      Data: [01-0B-31-32-33-34-31-38-33-33-41-35-41-41-41-41-41]

warn: DSC.TLink.ITv2.ITv2Session[0]

      Command ModuleStatus_Trouble_Detail_Notification

warn: DSC.TLink.ITv2.ITv2Session[0]

      Data: [01-00-01-87-01-00-01]

warn: DSC.TLink.ITv2.ITv2Session[0]

      Command Logging_Panel_Event_Buffer_Notification

warn: DSC.TLink.ITv2.ITv2Session[0]

      Data: [01-00-03-14-52-81]

warn: DSC.TLink.ITv2.ITv2Session[0]

      Command Notification_Text

warn: DSC.TLink.ITv2.ITv2Session[0]

      Data: [03-6C-00-53-00-E4-00-6B-00-65-00-72-00-68-00-65-00-74-00-73-00-73-00-79-00-73-00-74-00-65-00-6D-00-20-00-53-00-79-00-73-00-74-00-65-00-6D-00-20-00-41-00-72-00-65-00-61-00-20-00-42-00-61-00-74-00-74-00-65-00-72-00-69-00-66-00-65-00-6C-00-20-00-63-00-65-00-6E-00-74-00-72-00-61-00-6C-00-61-00-70-00-70-00-61-00-72-00-61-00-74-00-20]

warn: DSC.TLink.ITv2.ITv2Session[0]

      Command Notification_Any_Life_Safety_Communicable_Event

warn: DSC.TLink.ITv2.ITv2Session[0]

      Data: [01-0C-31-32-33-34-31-38-31-33-31-31-41-41-41-41-41]

warn: DSC.TLink.ITv2.ITv2Session[0]

      Command Logging_Panel_Event_Buffer_Notification

warn: DSC.TLink.ITv2.ITv2Session[0]

      Data: [01-00-03-21-52-8C]

fail: DSC.TLink.ITv2.ITv2Session[0]

      Fatal error in ITv2 session listen loop

      System.Exception: Framing CRC error!  Expected 0x0065 but calculated 0x81FA

         at DSC.TLink.ITv2.ITv2Framing.RemoveFraming(ReadOnlySpan`1& bytes) in /src/NeoHub/TLink/ITv2/ITv2Framing.cs:line 58

         at DSC.TLink.ITv2.ITv2Session.ParseITv2Message(Byte[] payload) in /src/NeoHub/TLink/ITv2/ITv2Session.cs:line 420

         at DSC.TLink.ITv2.ITv2Session.WaitForMessageAsync(CancellationToken cancellationToken) in /src/NeoHub/TLink/ITv2/ITv2Session.cs:line 397

         at DSC.TLink.ITv2.ITv2Session.ListenAsync(Action`1 continuation, CancellationToken cancellationToken) in /src/NeoHub/TLink/ITv2/ITv2Session.cs:line 198

info: DSC.TLink.ITv2.ITv2Session[0]

      ITv2 session listen loop exited

info: DSC.TLink.ITv2.MediatR.ITv2SessionManager[0]

      Unregistered session 151014018911. Active sessions: 0

info: NeoHub.Services.Handlers.SessionLifecycleHandler[0]

      Session disconnected: 151014018911

fail: DSC.TLink.ITv2ConnectionHandler[0]

      ITv2 connection error

      System.Exception: Framing CRC error!  Expected 0x0065 but calculated 0x81FA

         at DSC.TLink.ITv2.ITv2Framing.RemoveFraming(ReadOnlySpan`1& bytes) in /src/NeoHub/TLink/ITv2/ITv2Framing.cs:line 58

         at DSC.TLink.ITv2.ITv2Session.ParseITv2Message(Byte[] payload) in /src/NeoHub/TLink/ITv2/ITv2Session.cs:line 420

         at DSC.TLink.ITv2.ITv2Session.WaitForMessageAsync(CancellationToken cancellationToken) in /src/NeoHub/TLink/ITv2/ITv2Session.cs:line 397

         at DSC.TLink.ITv2.ITv2Session.ListenAsync(Action`1 continuation, CancellationToken cancellationToken) in /src/NeoHub/TLink/ITv2/ITv2Session.cs:line 198

         at DSC.TLink.ITv2ConnectionHandler.OnConnectedAsync(ConnectionContext connection) in /src/NeoHub/TLink/TLinkConnectionHandler.cs:line 72

         at DSC.TLink.ITv2ConnectionHandler.OnConnectedAsync(ConnectionContext connection) in /src/NeoHub/TLink/TLinkConnectionHandler.cs:line 79

info: DSC.TLink.ITv2ConnectionHandler[0]

      TLink disconnected from [::ffff:192.168.1.100]:3071

info: DSC.TLink.ITv2.ITv2Session[0]

      Receive queue is flushed.  Ready to start sending
      ```
      
      
      I also see logs in the neohub webinterface now. But I guess those are the same as I mention above.

**Reply by BrianHumlicek** [reply]
Ok, that's great news.  It is negotiating the handshake so all your config is correct.

I am seeing a bunch of message types in there I have never seen before.  I do have some handling for unknown messages that should hopefully work, but I will comb through your logs to ensure it handles them properly.  This is really helpful.

Brian

**Reply by Villhahallon** [reply]
Well... something seems to happen now...
put something in the type 2 access code and I now have an active session?...
But it is waiting on data. Is it waiting for the panel it self? alarm inputs and zones etc...?
I have reset the panel before starting this experiment so I will need to set a few inputs up in that case..

<img width="1139" height="421" alt="image" src="https://github.com/user-attachments/assets/76384d0d-4d74-4d2f-831a-a501fa47297d" />

**Reply by BrianHumlicek** [reply]
Yeah, once it is connected, you need to trigger zones to get them to show up in the server.  I'm pretty sure I know how to get the initial zone status, but its going to take some effort.

Brian

**Reply by Villhahallon** [reply]
and it disconnected now and I see those errors I wrote in my previous message.
Well I will tinker a bit and see what I can do to keep it stable. I will also try to write down all my settings so we can document this version and it's problems...

**Reply by BrianHumlicek** [reply]
I just push some extra exception details for your issue.  Pull the container again, re-run it and post a log.

Trace logs for both TLinkClient and ITv2Session would probably help.

**Reply by BrianHumlicek** [reply]
It looks like the notification message is
Säkerhetssystem System Area Batterifël centralapparat

**Reply by Villhahallon** [reply]
I might change the language to English again... :joy: 
Security system system area battery fault central unit.

I can now see partitions and zone information. I added 2 wireless units last night but they don't appear for now. I need to check my configuration for the alarm part.

<img width="1184" height="642" alt="image" src="https://github.com/user-attachments/assets/e29cc9a1-92fa-45d0-9590-0895eaf15a8a" />

**Reply by Villhahallon** [reply]
Would it be a bad idea to add a selection in the Neohub interface to change TL280 version? 
Selecting the older version could hide a few settings. Not sure how much would differ between the versions and how that will affect the Neohub interface later.

**Reply by BrianHumlicek** [reply]
Well, other than the settings page, as far as I know there is no functional difference, at least on my end.  At this time, I don't think it would be worth it, though I do strive to make it as simple as possible.
